<?xml version="1.0" encoding="UTF-8"?>
<tns:biblio xmlns:tns="http://pad.polito.it/dp2/biblio" xmlns:xsi="http://www.w3.org/2001/XMLSchema-instance" xsi:schemaLocation="http://pad.polito.it/dp2/biblio biblio_3.xsd ">
  <items>
    <article id="0" issue="7" journal="1551-3203">
    	<author>M. Cheminod</author>
    	<author>A. Pironti</author>
    	<author>R. Sisto</author>
    	<title>Formal Vulnerability Analysis of a Security System for Remote Fieldbus Access</title>
    </article>
    <book id="1" ISBN="0131411551" year="2004">
		<author>W. Richard Stevens</author>
    	<author>Bill Fenner</author>
    	<author>Andrew M. Rudoff</author>
    	<title>Unix network programming</title>
    	<subtitle>Volume 1: The sockets networking API</subtitle>
    	<publisher>Addison Wesley</publisher>
    </book>
    <article id="2" issue="1" journal="0141-9331">
        <author>T. Sauter</author>
	    <author>C. Schwaiger</author>
	    <title>Achievement of secure Internet access to fieldbus systems</title>
    	<citedBy>0</citedBy>
    </article>
    <chapter id="3" book="0131411551" number="1">
    	<author>W. Richard Stevens</author>
    	<author>Bill Fenner</author>
    	<author>Andrew M. Rudoff</author>
    	<title>Introduction</title>
    </chapter>
    <chapter id="4" book="0131411551" number="2">
    	<author>W. Richard Stevens</author>
    	<author>Bill Fenner</author>
    	<author>Andrew M. Rudoff</author>
    	<title>The Transport Layer: TCP, UDP and SCTP</title>
    </chapter>
    <book id="5" ISBN="9781449358068" year="2013">
		<author>Leonard Richardson</author>
    	<author>Mike Amundsen</author>
    	<title>RESTful Web APIs</title>
    	<publisher>Oâ€™Reilly</publisher>
    </book>
    <chapter id="6" book="9781449358068" number="1">
		<author>Leonard Richardson</author>
    	<author>Mike Amundsen</author>
    	<title>Surfing the Web</title>
    </chapter>
  </items>
  <journals>
    <journal ISSN="1551-3203">
	    <title>IEEE Transactions on Industrial Informatics</title>
	    <publisher>IEEE</publisher>
	    <issue id="1" number="1" year="2011"/>
	    <issue id="2" number="2" year="2011"/>
	    <issue id="3" number="3" year="2011"/>
	    <issue id="4" number="4" year="2011"/>
	    <issue id="5" number="5" year="2011"/>
	    <issue id="6" number="6" year="2011"/>
	    <issue id="7" number="7" year="2011"/>
	    <issue id="8" number="8" year="2011"/>
	    <issue id="9" number="9" year="2011"/>
	    <issue id="10" number="10" year="2011"/>
	    <issue id="11" number="11" year="2011"/>
	    <issue id="12" number="12" year="2011"/>
    </journal>
    <journal ISSN="0141-9331">
  		<title>Microprocessors and Microsystems</title>
  		<publisher>Elsevier</publisher>
    	<issue id="0" number="7" year="2002"/>
  	</journal>
  </journals>
</tns:biblio>
