<?xml version="1.0" encoding="UTF-8" standalone="yes"?>
<ns2:biblio xmlns:ns2="http://pad.polito.it/dp2/biblio_3"
            xmlns:xsi="http://www.w3.org/2001/XMLSchema-instance"
            xsi:schemaLocation="http://pad.polito.it/dp2/biblio_3 biblio_3.xsd">
    <article journal="0141-9331" issue="0" id="0">
        <author>T. Sauter</author>
        <author>C. Schwaiger</author>
        <title>Achievement of secure Internet access to fieldbus systems</title>
        <citedBy>14</citedBy>
    </article>
    <article journal="1551-3203" issue="7" id="1">
        <author>M. Cheminod</author>
        <author>A. Pironti</author>
        <author>R. Sisto</author>
        <title>Formal Vulnerability Analysis of a Security System for Remote Fieldbus Access</title>
        <citedBy>4</citedBy>
    </article>
    <book ISBN="0131411551" year="2004" id="2">
        <author>W. Richard Stevens</author>
        <author>Bill Fenner</author>
        <author>Andrew M. Rudoff</author>
        <title>Unix network programming</title>
        <subtitle>Volume 1: The sockets networking API</subtitle>
        <citedBy>0</citedBy>
        <publisher>Addison Wesley</publisher>
        <chapter number="0" id="4">
            <author>AAAA</author>
            <title>AAAA</title>
            <citedBy>7</citedBy>
        </chapter>
        <chapter number="1" id="7">
            <author>BBBB</author>
            <title>BBBB</title>
            <citedBy>14</citedBy>
        </chapter>
    </book>
    <book ISBN="0131411951" year="2004" id="3">
        <author>Bill</author>
        <author>Andrew</author>
        <title>Unix network</title>
        <subtitle>Volume 1</subtitle>
        <publisher>Addison</publisher>
        <chapter number="0" id="8">
            <author>AAAA</author>
            <title>AAAA</title>
            <citedBy>14</citedBy>
        </chapter>
        <chapter number="1" id="14">
            <author>BBBB</author>
            <title>BBBB</title>
            <citedBy>7</citedBy>
        </chapter>
    </book>
    <journal ISSN="0141-9331">
        <title>Microprocessors and Microsystems</title>
        <publisher>Elsevier</publisher>
        <issue id="0" year="2002" number="7"/>
    </journal>
    <journal ISSN="1551-3203">
        <title>IEEE Transactions on Industrial Informatics</title>
        <publisher>IEEE</publisher>
        <issue id="1" year="2011" number="1"/>
        <issue id="2" year="2011" number="2"/>
        <issue id="3" year="2011" number="3"/>
        <issue id="4" year="2011" number="4"/>
        <issue id="5" year="2011" number="5"/>
        <issue id="6" year="2011" number="6"/>
        <issue id="7" year="2011" number="7"/>
        <issue id="8" year="2011" number="8"/>
        <issue id="9" year="2011" number="9"/>
        <issue id="10" year="2011" number="10"/>
        <issue id="11" year="2011" number="11"/>
        <issue id="12" year="2011" number="12"/>
    </journal>
    <journal ISSN="1551-3000">
        <title>IEEE Transactions</title>
        <publisher>IEEE</publisher>
        <issue id="13" year="2011" number="1"/>
        <issue id="14" year="2011" number="2"/>
        <issue id="15" year="2013" number="1"/>
    </journal>
</ns2:biblio>
